{
  "contract": "warroom.import",
  "contract_version": "1.0",
  "batch": {
    "source_batch_id": "gridiron_nfl-2026-Week 3-20260923T190000Z",
    "source_app": "gridiron_nfl",
    "model_name": "Gridiron NFL",
    "model_version": "2.2.0",
    "model_config": {
      "gain": 0.0624,
      "qb_gain": 0.0372,
      "qb_share": 0.4683,
      "revert": 0.3949,
      "qb_revert": 0.0236,
      "qb_prior": -0.8695,
      "qb_ramp": 3,
      "base": 21.5,
      "hfa": 1.6464,
      "rest_coef": 0.0674,
      "wind_coef": -0.1503,
      "roof_bonus": 0.349,
      "KELLY_FRAC": 0.25,
      "MAX_STAKE": 0.02,
      "EV_BAR": 0.02,
      "NOVIG_BAR": 0.04,
      "shrink_margin": 0.14301181006929758,
      "shrink_total": 0.05210451852970373,
      "shrink_n": 7276,
      "shrink_fallback": false,
      "band_cuts": [
        41.5,
        45.5
      ],
      "tie_rate": 0.002061572292468389,
      "fit_through": "2026_02_NYG_LA",
      "price_source": "odds_api",
      "books": [
        "DK",
        "FD",
        "MGM",
        "CZR",
        "FAN"
      ],
      "prices_pulled_at": "2026-09-23T19:00:00Z"
    },
    "generated_at": "2026-09-23T19:00:00Z",
    "is_backfill": false
  },
  "records": [
    {
      "record_id": "2026_03_ATL_GB-spread-home",
      "sport": "NFL",
      "league": "NFL",
      "season": 2026,
      "grouping": {
        "type": "week",
        "label": "Week 3"
      },
      "event": {
        "source_event_id": "2026_03_ATL_GB",
        "start_time": "2026-09-25T00:15:00Z",
        "start_time_precision": "exact",
        "timezone": "America/New_York",
        "neutral_site": false,
        "participants": [
          {
            "role": "away",
            "name": "ATL"
          },
          {
            "role": "home",
            "name": "GB"
          }
        ]
      },
      "market": {
        "type": "spread",
        "period": "full_game",
        "participant_scope": null,
        "is_alternate": false
      },
      "selection": {
        "side": "home",
        "label": "GB -4.5"
      },
      "price": {
        "line": -4.5,
        "american_odds": -108,
        "opposite_american_odds": -112,
        "sportsbook": "MGM",
        "captured_at": "2026-09-23T19:00:00Z"
      },
      "model": {
        "prob_win": 0.476859,
        "prob_push": 0.023142,
        "prob_loss": 0.499999,
        "projection": {
          "kind": "margin",
          "value": 5.553
        },
        "fair_line": -5.553,
        "ladder": [
          {
            "line": -6.5,
            "prob_win": 0.420913,
            "prob_push": 0.013996
          },
          {
            "line": -6,
            "prob_win": 0.434909,
            "prob_push": 0.011367
          },
          {
            "line": -5.5,
            "prob_win": 0.446276,
            "prob_push": 0.014421
          },
          {
            "line": -5,
            "prob_win": 0.460697,
            "prob_push": 0.016162
          },
          {
            "line": -4.5,
            "prob_win": 0.476859,
            "prob_push": 0.023142
          },
          {
            "line": -4,
            "prob_win": 0.500001,
            "prob_push": 0.020513
          },
          {
            "line": -3.5,
            "prob_win": 0.520514,
            "prob_push": 0.016578
          },
          {
            "line": -3,
            "prob_win": 0.537093,
            "prob_push": 0.017444
          },
          {
            "line": -2.5,
            "prob_win": 0.554537,
            "prob_push": 0.021796
          }
        ]
      },
      "flags": [
        "early_season",
        "push_on_half_line"
      ]
    },
    {
      "record_id": "2026_03_ATL_GB-spread-away",
      "sport": "NFL",
      "league": "NFL",
      "season": 2026,
      "grouping": {
        "type": "week",
        "label": "Week 3"
      },
      "event": {
        "source_event_id": "2026_03_ATL_GB",
        "start_time": "2026-09-25T00:15:00Z",
        "start_time_precision": "exact",
        "timezone": "America/New_York",
        "neutral_site": false,
        "participants": [
          {
            "role": "away",
            "name": "ATL"
          },
          {
            "role": "home",
            "name": "GB"
          }
        ]
      },
      "market": {
        "type": "spread",
        "period": "full_game",
        "participant_scope": null,
        "is_alternate": false
      },
      "selection": {
        "side": "away",
        "label": "ATL +4.5"
      },
      "price": {
        "line": 4.5,
        "american_odds": -108,
        "opposite_american_odds": -110,
        "sportsbook": "CZR",
        "captured_at": "2026-09-23T19:00:00Z"
      },
      "model": {
        "prob_win": 0.499999,
        "prob_push": 0.023142,
        "prob_loss": 0.476859,
        "projection": {
          "kind": "margin",
          "value": -5.553
        },
        "fair_line": 5.553,
        "ladder": [
          {
            "line": 2.5,
            "prob_win": 0.423668,
            "prob_push": 0.021796
          },
          {
            "line": 3,
            "prob_win": 0.445463,
            "prob_push": 0.017444
          },
          {
            "line": 3.5,
            "prob_win": 0.462907,
            "prob_push": 0.016578
          },
          {
            "line": 4,
            "prob_win": 0.479486,
            "prob_push": 0.020513
          },
          {
            "line": 4.5,
            "prob_win": 0.499999,
            "prob_push": 0.023142
          },
          {
            "line": 5,
            "prob_win": 0.523141,
            "prob_push": 0.016162
          },
          {
            "line": 5.5,
            "prob_win": 0.539303,
            "prob_push": 0.014421
          },
          {
            "line": 6,
            "prob_win": 0.553724,
            "prob_push": 0.011367
          },
          {
            "line": 6.5,
            "prob_win": 0.565091,
            "prob_push": 0.013996
          }
        ]
      },
      "flags": [
        "early_season",
        "push_on_half_line"
      ]
    },
    {
      "record_id": "2026_03_ATL_GB-moneyline-home",
      "sport": "NFL",
      "league": "NFL",
      "season": 2026,
      "grouping": {
        "type": "week",
        "label": "Week 3"
      },
      "event": {
        "source_event_id": "2026_03_ATL_GB",
        "start_time": "2026-09-25T00:15:00Z",
        "start_time_precision": "exact",
        "timezone": "America/New_York",
        "neutral_site": false,
        "participants": [
          {
            "role": "away",
            "name": "ATL"
          },
          {
            "role": "home",
            "name": "GB"
          }
        ]
      },
      "market": {
        "type": "moneyline",
        "period": "full_game",
        "participant_scope": null,
        "is_alternate": false
      },
      "selection": {
        "side": "home",
        "label": "GB ML"
      },
      "price": {
        "american_odds": -258,
        "opposite_american_odds": 205,
        "sportsbook": "DK",
        "captured_at": "2026-09-23T19:00:00Z"
      },
      "model": {
        "prob_win": 0.655184,
        "prob_push": 0.002062,
        "prob_loss": 0.342755
      },
      "flags": [
        "early_season"
      ]
    },
    {
      "record_id": "2026_03_ATL_GB-moneyline-away",
      "sport": "NFL",
      "league": "NFL",
      "season": 2026,
      "grouping": {
        "type": "week",
        "label": "Week 3"
      },
      "event": {
        "source_event_id": "2026_03_ATL_GB",
        "start_time": "2026-09-25T00:15:00Z",
        "start_time_precision": "exact",
        "timezone": "America/New_York",
        "neutral_site": false,
        "participants": [
          {
            "role": "away",
            "name": "ATL"
          },
          {
            "role": "home",
            "name": "GB"
          }
        ]
      },
      "market": {
        "type": "moneyline",
        "period": "full_game",
        "participant_scope": null,
        "is_alternate": false
      },
      "selection": {
        "side": "away",
        "label": "ATL ML"
      },
      "price": {
        "american_odds": 220,
        "opposite_american_odds": -253,
        "sportsbook": "CZR",
        "captured_at": "2026-09-23T19:00:00Z"
      },
      "model": {
        "prob_win": 0.355439,
        "prob_push": 0.002062,
        "prob_loss": 0.6425
      },
      "flags": [
        "early_season"
      ]
    },
    {
      "record_id": "2026_03_ATL_GB-total-over",
      "sport": "NFL",
      "league": "NFL",
      "season": 2026,
      "grouping": {
        "type": "week",
        "label": "Week 3"
      },
      "event": {
        "source_event_id": "2026_03_ATL_GB",
        "start_time": "2026-09-25T00:15:00Z",
        "start_time_precision": "exact",
        "timezone": "America/New_York",
        "neutral_site": false,
        "participants": [
          {
            "role": "away",
            "name": "ATL"
          },
          {
            "role": "home",
            "name": "GB"
          }
        ]
      },
      "market": {
        "type": "total",
        "period": "full_game",
        "participant_scope": null,
        "is_alternate": false
      },
      "selection": {
        "side": "over",
        "label": "Over 42.5"
      },
      "price": {
        "line": 42.5,
        "american_odds": -105,
        "opposite_american_odds": -115,
        "sportsbook": "FAN",
        "captured_at": "2026-09-23T19:00:00Z"
      },
      "model": {
        "prob_win": 0.4907,
        "prob_push": 0.017018,
        "prob_loss": 0.492281,
        "projection": {
          "kind": "total",
          "value": 46.38
        },
        "fair_line": 46.38,
        "ladder": [
          {
            "line": 40.5,
            "prob_win": 0.553921,
            "prob_push": 0.020899
          },
          {
            "line": 41,
            "prob_win": 0.53998,